{
  "$schema": "https://json-schema.org/draft/2020-12/schema",
  "title": "Tablero Kakuro (salida de la Fase 1, entrada de la Fase 2)",
  "type": "object",
  "required": ["rows", "cols", "grid"],
  "properties": {
    "rows": {"type": "integer", "minimum": 2},
    "cols": {"type": "integer", "minimum": 2},
    "grid": {
      "description": "Filas de tokens: '.' blanca, '#' negra, 'D\\\\R' pista (D = suma vertical, R = suma horizontal; cualquiera puede ir vacía)",
      "type": "array",
      "items": {
        "type": "array",
        "items": {"type": "string", "pattern": "^(\\.|#|([1-9][0-9]?)?\\\\([1-9][0-9]?)?)$"}
      }
    },
    "source": {"type": ["string", "null"], "description": "ruta de la imagen de origen"},
    "ocr_engine": {"type": "string", "enum": ["cnn", "tesseract"]},
    "clue_confidence": {
      "type": "object",
      "description": "'fila,col' -> confianza mínima de las pistas de esa celda",
      "additionalProperties": {"type": "number", "minimum": 0, "maximum": 1}
    },
    "warnings": {"type": "array", "items": {"type": "string"}},
    "solution": {
      "type": "array",
      "description": "sólo en datos de referencia: dígito de cada celda blanca (0 en el resto)",
      "items": {"type": "array", "items": {"type": "integer", "minimum": 0, "maximum": 9}}
    }
  }
}
