{
  "rows": 7,
  "cols": 7,
  "grid": [
    [
      "#",
      "10\\",
      "9\\",
      "#",
      "11\\",
      "3\\",
      "#"
    ],
    [
      "\\3",
      ".",
      ".",
      "22\\7",
      ".",
      ".",
      "#"
    ],
    [
      "\\26",
      ".",
      ".",
      ".",
      ".",
      ".",
      "#"
    ],
    [
      "#",
      "\\6",
      ".",
      ".",
      "12\\",
      "#",
      "#"
    ],
    [
      "#",
      "5\\",
      "8\\14",
      ".",
      ".",
      "4\\",
      "#"
    ],
    [
      "\\20",
      ".",
      ".",
      ".",
      ".",
      ".",
      "#"
    ],
    [
      "\\4",
      ".",
      ".",
      "\\4",
      ".",
      ".",
      "#"
    ]
  ],
  "solution": [
    [
      0,
      0,
      0,
      0,
      0,
      0,
      0
    ],
    [
      0,
      1,
      2,
      0,
      5,
      2,
      0
    ],
    [
      0,
      9,
      3,
      7,
      6,
      1,
      0
    ],
    [
      0,
      0,
      4,
      2,
      0,
      0,
      0
    ],
    [
      0,
      0,
      0,
      5,
      9,
      0,
      0
    ],
    [
      0,
      4,
      5,
      8,
      2,
      1,
      0
    ],
    [
      0,
      1,
      3,
      0,
      1,
      3,
      0
    ]
  ]
}