{
  "rows": 7,
  "cols": 7,
  "grid": [
    [
      "#",
      "4\\",
      "12\\",
      "#",
      "#",
      "16\\",
      "17\\"
    ],
    [
      "\\3",
      ".",
      ".",
      "#",
      "12\\17",
      ".",
      "."
    ],
    [
      "\\12",
      ".",
      ".",
      "14\\24",
      ".",
      ".",
      "."
    ],
    [
      "#",
      "\\6",
      ".",
      ".",
      ".",
      "8\\",
      "6\\"
    ],
    [
      "#",
      "16\\",
      "9\\11",
      ".",
      ".",
      ".",
      "."
    ],
    [
      "\\17",
      ".",
      ".",
      ".",
      "\\3",
      ".",
      "."
    ],
    [
      "\\17",
      ".",
      ".",
      "#",
      "\\4",
      ".",
      "."
    ]
  ],
  "source": "C:\\Users\\bruno\\Desktop\\UPC\\8vo_semestre\\Topicos\\Proyecto\\Codigo\\kakuro-cp_f1\\data\\test_set\\real\\imagen3.png",
  "ocr_engine": "cnn",
  "clue_confidence": {
    "0,1": 0.9232,
    "0,2": 0.9007,
    "0,5": 0.8899,
    "0,6": 0.8942,
    "1,0": 0.9643,
    "1,4": 0.8855,
    "2,0": 0.906,
    "2,3": 0.8786,
    "3,1": 0.9605,
    "3,5": 0.9653,
    "3,6": 0.9439,
    "4,1": 0.8994,
    "4,2": 0.8882,
    "5,0": 0.8879,
    "5,4": 0.949,
    "6,0": 0.8878,
    "6,4": 0.9608
  },
  "warnings": []
}