{
  "rows": 10,
  "cols": 8,
  "grid": [
    [
      "#",
      "30\\",
      "32\\",
      "20\\",
      "16\\",
      "#",
      "11\\",
      "17\\"
    ],
    [
      "\\18",
      ".",
      ".",
      ".",
      ".",
      "\\7",
      ".",
      "."
    ],
    [
      "\\30",
      ".",
      ".",
      ".",
      ".",
      "6\\4",
      ".",
      "."
    ],
    [
      "\\24",
      ".",
      ".",
      ".",
      "23\\19",
      ".",
      ".",
      "."
    ],
    [
      "\\17",
      ".",
      ".",
      "13\\12",
      ".",
      ".",
      "18\\",
      "#"
    ],
    [
      "#",
      "\\27",
      ".",
      ".",
      ".",
      ".",
      ".",
      "30\\"
    ],
    [
      "#",
      "9\\",
      "19\\17",
      ".",
      ".",
      "22\\13",
      ".",
      "."
    ],
    [
      "\\11",
      ".",
      ".",
      ".",
      "17\\20",
      ".",
      ".",
      "."
    ],
    [
      "\\15",
      ".",
      ".",
      "\\26",
      ".",
      ".",
      ".",
      "."
    ],
    [
      "\\3",
      ".",
      ".",
      "\\20",
      ".",
      ".",
      ".",
      "."
    ]
  ],
  "source": "C:\\Users\\bruno\\Desktop\\UPC\\8vo_semestre\\Topicos\\Proyecto\\Codigo\\kakuro-cp_f1\\data\\test_set\\real\\nivel2.jpeg",
  "ocr_engine": "cnn",
  "clue_confidence": {
    "0,1": 0.9156,
    "0,2": 0.9131,
    "0,3": 0.9189,
    "0,4": 0.8121,
    "0,6": 0.814,
    "0,7": 0.8626,
    "1,0": 0.8723,
    "1,5": 0.9508,
    "2,0": 0.912,
    "2,5": 0.931,
    "3,0": 0.9022,
    "3,4": 0.8429,
    "4,0": 0.8731,
    "4,3": 0.8324,
    "4,6": 0.8686,
    "5,1": 0.9109,
    "5,7": 0.8967,
    "6,1": 0.9627,
    "6,2": 0.8208,
    "6,5": 0.8752,
    "7,0": 0.8359,
    "7,4": 0.8587,
    "8,0": 0.8608,
    "8,3": 0.9035,
    "9,0": 0.9541,
    "9,3": 0.9147
  },
  "warnings": []
}